Item(Global): Usage Page, data= [ 0x84 ] 132
                Power Device Page
Item(Local ): Usage, data= [ 0x04 ] 4
                UPS
Item(Main  ): Collection, data= [ 0x01 ] 1
                    Application
    Item(Local ): Usage, data= [ 0x24 ] 36
                    Power Summary
    Item(Main  ): Collection, data= [ 0x00 ] 0
                        Physical

        Item(Global): Report ID, data= [ 0x28 ] 40
        Item(Local ): Usage, data= [ 0xfe ] 254
                        iProduct
        Item(Local ): String Index, data= [ 0x01 ] 1
        Item(Global): Report Size, data= [ 0x08 ] 8
        Item(Global): Report Count, data= [ 0x01 ] 1
        Item(Global): Logical Minimum, data= [ 0x00 ] 0
        Item(Global): Logical Maximum, data= [ 0xff 0x00 ] 255
        Item(Main  ): Feature, data= [ 0x03 ] 3
                        Constant Variable Absolute No_Wrap Linear
                        Preferred_State No_Null_Position Non_Volatile Bitfield

        Item(Global): Report ID, data= [ 0x29 ] 41
        Item(Local ): Usage, data= [ 0xff ] 255
                        iSerialNumber
        Item(Local ): String Index, data= [ 0x05 ] 5
        Item(Main  ): Feature, data= [ 0x03 ] 3
                        Constant Variable Absolute No_Wrap Linear
                        Preferred_State No_Null_Position Non_Volatile Bitfield

        Item(Global): Report ID, data= [ 0x2b ] 43
        Item(Local ): Usage, data= [ 0xfd ] 253
                        iManufacturer
        Item(Local ): String Index, data= [ 0x03 ] 3
        Item(Main  ): Feature, data= [ 0x03 ] 3
                        Constant Variable Absolute No_Wrap Linear
                        Preferred_State No_Null_Position Non_Volatile Bitfield

        Item(Local ): Usage, data= [ 0x1a ] 26
                        Input
        Item(Main  ): Collection, data= [ 0x02 ] 2
                        Logical

            Item(Global): Report ID, data= [ 0x30 ] 48
            Item(Local ): Usage, data= [ 0x40 ] 64
                            Config Voltage
            Item(Global): Unit, data= [ 0x21 0xd1 0xf0 0x00 ] 15782177
                            System: SI Linear, Unit: Centimeter^2*Gram*Seconds^-3*Ampere^-1
            Item(Global): Unit Exponent, data= [ 0x07 ] 7
                            Unit Exponent: 7
            Item(Main  ): Feature, data= [ 0x83 ] 131
                            Constant Variable Absolute No_Wrap Linear
                            Preferred_State No_Null_Position Volatile Bitfield

            Item(Global): Report ID, data= [ 0x31 ] 49
            Item(Local ): Usage, data= [ 0x30 ] 48
                            Voltage
            Item(Global): Report Size, data= [ 0x10 ] 16
            Item(Global): Report Count, data= [ 0x01 ] 1
            Item(Global): Logical Minimum, data= [ 0x00 ] 0
            Item(Global): Logical Maximum, data= [ 0xff 0xff 0x00 0x00 ] 65535
            Item(Global): Unit, data= [ 0x21 0xd1 0xf0 0x00 ] 15782177
                            System: SI Linear, Unit: Centimeter^2*Gram*Seconds^-3*Ampere^-1
            Item(Global): Unit Exponent, data= [ 0x01 ] 1
                            Unit Exponent: 1
            Item(Main  ): Feature, data= [ 0x02 ] 2
                            Data Variable Absolute No_Wrap Linear
                            Preferred_State No_Null_Position Non_Volatile Bitfield

        Item(Main  ): End Collection, data=none

        Item(Global): Report ID, data= [ 0x11 ] 17
        Item(Local ): Usage, data= [ 0x5a ] 90
                        Audible Alarm Control
        Item(Global): Report Size, data= [ 0x08 ] 8
        Item(Global): Report Count, data= [ 0x01 ] 1
        Item(Global): Logical Minimum, data= [ 0x01 ] 1
        Item(Global): Logical Maximum, data= [ 0x03 ] 3
        Item(Global): Unit, data= [ 0x00 ] 0
                        System: None, Unit: (None)
        Item(Global): Unit Exponent, data= [ 0x00 ] 0
                        Unit Exponent: 0
        Item(Main  ): Feature, data= [ 0x82 ] 130
                        Data Variable Absolute No_Wrap Linear
                        Preferred_State No_Null_Position Volatile Bitfield

        Item(Local ): Usage, data= [ 0x02 ] 2
                        Present Status
        Item(Main  ): Collection, data= [ 0x02 ] 2
                        Logical

            Item(Global): Report ID, data= [ 0x32 ] 50
            Item(Global): Report Size, data= [ 0x01 ] 1
            Item(Global): Report Count, data= [ 0x07 ] 7
            Item(Global): Logical Minimum, data= [ 0x00 ] 0
            Item(Global): Logical Maximum, data= [ 0x01 ] 1
            Item(Main  ): Input, data= [ 0x03 ] 3
                            Constant Variable Absolute No_Wrap Linear
                            Preferred_State No_Null_Position Non_Volatile Bitfield
            Item(Main  ): Feature, data= [ 0x03 ] 3
                            Constant Variable Absolute No_Wrap Linear
                            Preferred_State No_Null_Position Non_Volatile Bitfield
            Item(Local ): Usage, data= [ 0x62 ] 98
                            Internal Failure
            Item(Global): Report Count, data= [ 0x01 ] 1
            Item(Main  ): Feature, data= [ 0xa2 ] 162
                            Data Variable Absolute No_Wrap Linear
                            No_Preferred_State No_Null_Position Volatile Bitfield
            Item(Local ): Usage, data= [ 0x62 ] 98
                            Internal Failure
            Item(Main  ): Input, data= [ 0xa2 ] 162
                            Data Variable Absolute No_Wrap Linear
                            No_Preferred_State No_Null_Position Volatile Bitfield
            Item(Main  ): Feature, data= [ 0x01 ] 1
                            Constant Array Absolute No_Wrap Linear
                            Preferred_State No_Null_Position Non_Volatile Bitfield
            Item(Main  ): Input, data= [ 0x01 ] 1
                            Constant Array Absolute No_Wrap Linear
                            Preferred_State No_Null_Position Non_Volatile Bitfield
            Item(Local ): Usage, data= [ 0x69 ] 105
                            Shutdown  Imminent
            Item(Main  ): Feature, data= [ 0xa2 ] 162
                            Data Variable Absolute No_Wrap Linear
                            No_Preferred_State No_Null_Position Volatile Bitfield
            Item(Local ): Usage, data= [ 0x69 ] 105
                            Shutdown  Imminent
            Item(Main  ): Input, data= [ 0xa2 ] 162
                            Data Variable Absolute No_Wrap Linear
                            No_Preferred_State No_Null_Position Volatile Bitfield
            Item(Global): Report Count, data= [ 0x06 ] 6
            Item(Main  ): Feature, data= [ 0x01 ] 1
                            Constant Array Absolute No_Wrap Linear
                            Preferred_State No_Null_Position Non_Volatile Bitfield
            Item(Main  ): Input, data= [ 0x01 ] 1
                            Constant Array Absolute No_Wrap Linear
                            Preferred_State No_Null_Position Non_Volatile Bitfield
            Item(Global): Usage Page, data= [ 0x85 ] 133
                            Battery System Page
            Item(Local ): Usage, data= [ 0xd0 ] 208
                            AC Present
            Item(Global): Report Count, data= [ 0x01 ] 1
            Item(Main  ): Input, data= [ 0xa2 ] 162
                            Data Variable Absolute No_Wrap Linear
                            No_Preferred_State No_Null_Position Volatile Bitfield
            Item(Local ): Usage, data= [ 0xd0 ] 208
                            AC Present
            Item(Main  ): Feature, data= [ 0xa2 ] 162
                            Data Variable Absolute No_Wrap Linear
                            No_Preferred_State No_Null_Position Volatile Bitfield
            Item(Main  ): Input, data= [ 0x01 ] 1
                            Constant Array Absolute No_Wrap Linear
                            Preferred_State No_Null_Position Non_Volatile Bitfield
            Item(Main  ): Feature, data= [ 0x01 ] 1
                            Constant Array Absolute No_Wrap Linear
                            Preferred_State No_Null_Position Non_Volatile Bitfield
            Item(Global): Report Count, data= [ 0x06 ] 6
            Item(Local ): Usage, data= [ 0x42 ] 66
                            Below Remaining Capacity Limit
            Item(Local ): Usage, data= [ 0x46 ] 70
                            Fully Charged
            Item(Local ): Usage, data= [ 0x44 ] 68
                            Charging
            Item(Local ): Usage, data= [ 0x45 ] 69
                            Discharging
            Item(Local ): Usage, data= [ 0x47 ] 71
                            Fully Discharged
            Item(Local ): Usage, data= [ 0x4b ] 75
                            Need Replacement
            Item(Main  ): Input, data= [ 0xa2 ] 162
                            Data Variable Absolute No_Wrap Linear
                            No_Preferred_State No_Null_Position Volatile Bitfield
            Item(Local ): Usage, data= [ 0x42 ] 66
                            Below Remaining Capacity Limit
            Item(Local ): Usage, data= [ 0x46 ] 70
                            Fully Charged
            Item(Local ): Usage, data= [ 0x44 ] 68
                            Charging
            Item(Local ): Usage, data= [ 0x45 ] 69
                            Discharging
            Item(Local ): Usage, data= [ 0x47 ] 71
                            Fully Discharged
            Item(Local ): Usage, data= [ 0x4b ] 75
                            Need Replacement
            Item(Main  ): Feature, data= [ 0xa2 ] 162
                            Data Variable Absolute No_Wrap Linear
                            No_Preferred_State No_Null_Position Volatile Bitfield

        Item(Main  ): End Collection, data=none

        Item(Global): Report ID, data= [ 0x2a ] 42
        Item(Local ): Usage, data= [ 0x89 ] 137
                        iDeviceChemistry
        Item(Local ): String Index, data= [ 0x04 ] 4
        Item(Global): Report Size, data= [ 0x08 ] 8
        Item(Global): Report Count, data= [ 0x01 ] 1
        Item(Global): Logical Minimum, data= [ 0x00 ] 0
        Item(Global): Logical Maximum, data= [ 0xff 0x00 ] 255
        Item(Main  ): Feature, data= [ 0x03 ] 3
                        Constant Variable Absolute No_Wrap Linear
                        Preferred_State No_Null_Position Non_Volatile Bitfield

        Item(Global): Report ID, data= [ 0x62 ] 98
        Item(Local ): Usage, data= [ 0x8f ] 143
                        iOEMInformation
        Item(Local ): String Index, data= [ 0x02 ] 2
        Item(Main  ): Feature, data= [ 0x03 ] 3
                        Constant Variable Absolute No_Wrap Linear
                        Preferred_State No_Null_Position Non_Volatile Bitfield

        Item(Global): Report ID, data= [ 0x33 ] 51
        Item(Local ): Usage, data= [ 0x2c ] 44
                        Capacity Mode
        Item(Main  ): Feature, data= [ 0x03 ] 3
                        Constant Variable Absolute No_Wrap Linear
                        Preferred_State No_Null_Position Non_Volatile Bitfield

        Item(Global): Report ID, data= [ 0x34 ] 52
        Item(Local ): Usage, data= [ 0x66 ] 102
                        Remaining Capacity
        Item(Main  ): Input, data= [ 0xa2 ] 162
                        Data Variable Absolute No_Wrap Linear
                        No_Preferred_State No_Null_Position Volatile Bitfield
        Item(Local ): Usage, data= [ 0x66 ] 102
                        Remaining Capacity
        Item(Main  ): Feature, data= [ 0xa2 ] 162
                        Data Variable Absolute No_Wrap Linear
                        No_Preferred_State No_Null_Position Volatile Bitfield

        Item(Global): Report ID, data= [ 0x37 ] 55
        Item(Local ): Usage, data= [ 0x67 ] 103
                        Full Charge Capacity
        Item(Main  ): Feature, data= [ 0x03 ] 3
                        Constant Variable Absolute No_Wrap Linear
                        Preferred_State No_Null_Position Non_Volatile Bitfield

        Item(Global): Report ID, data= [ 0x36 ] 54
        Item(Local ): Usage, data= [ 0x83 ] 131
                        Design Capacity
        Item(Main  ): Feature, data= [ 0x03 ] 3
                        Constant Variable Absolute No_Wrap Linear
                        Preferred_State No_Null_Position Non_Volatile Bitfield

        Item(Global): Report ID, data= [ 0x38 ] 56
        Item(Local ): Usage, data= [ 0x8c ] 140
                        Warning Capacity Limit
        Item(Main  ): Feature, data= [ 0xa2 ] 162
                        Data Variable Absolute No_Wrap Linear
                        No_Preferred_State No_Null_Position Volatile Bitfield

        Item(Global): Report ID, data= [ 0x2c ] 44
        Item(Local ): Usage, data= [ 0x8b ] 139
                        Rechargeable
        Item(Main  ): Feature, data= [ 0x03 ] 3
                        Constant Variable Absolute No_Wrap Linear
                        Preferred_State No_Null_Position Non_Volatile Bitfield

        Item(Global): Report ID, data= [ 0x35 ] 53
        Item(Local ): Usage, data= [ 0x68 ] 104
                        Run Time To Empty
        Item(Global): Report Size, data= [ 0x10 ] 16
        Item(Global): Logical Maximum, data= [ 0xff 0xff 0x00 0x00 ] 65535
        Item(Global): Unit, data= [ 0x01 0x10 ] 4097
                        System: SI Linear, Unit: Seconds
        Item(Global): Unit Exponent, data= [ 0x00 ] 0
                        Unit Exponent: 0
        Item(Main  ): Input, data= [ 0xa2 ] 162
                        Data Variable Absolute No_Wrap Linear
                        No_Preferred_State No_Null_Position Volatile Bitfield
        Item(Local ): Usage, data= [ 0x68 ] 104
                        Run Time To Empty
        Item(Main  ): Feature, data= [ 0xa2 ] 162
                        Data Variable Absolute No_Wrap Linear
                        No_Preferred_State No_Null_Position Volatile Bitfield

    Item(Main  ): End Collection, data=none

    Item(Global): Usage Page, data= [ 0x84 ] 132
                    Power Device Page
    Item(Local ): Usage, data= [ 0x10 ] 16
                    Battery System
    Item(Main  ): Collection, data= [ 0x02 ] 2
                    Logical
        Item(Local ): Usage, data= [ 0x12 ] 18
                        Battery
        Item(Main  ): Collection, data= [ 0x02 ] 2
                        Logical

            Item(Global): Report ID, data= [ 0x04 ] 4
            Item(Local ): Usage, data= [ 0x40 ] 64
                            Config Voltage
            Item(Global): Unit, data= [ 0x21 0xd1 0xf0 0x00 ] 15782177
                            System: SI Linear, Unit: Centimeter^2*Gram*Seconds^-3*Ampere^-1
            Item(Global): Unit Exponent, data= [ 0x07 ] 7
                            Unit Exponent: 7
            Item(Main  ): Feature, data= [ 0x02 ] 2
                            Data Variable Absolute No_Wrap Linear
                            Preferred_State No_Null_Position Non_Volatile Bitfield

            Item(Global): Report ID, data= [ 0x20 ] 32
            Item(Local ): Usage, data= [ 0x30 ] 48
                            Voltage
            Item(Global): Unit, data= [ 0x21 0xd1 0xf0 0x00 ] 15782177
                            System: SI Linear, Unit: Centimeter^2*Gram*Seconds^-3*Ampere^-1
            Item(Global): Unit Exponent, data= [ 0x01 ] 1
                            Unit Exponent: 1
            Item(Main  ): Feature, data= [ 0xa2 ] 162
                            Data Variable Absolute No_Wrap Linear
                            No_Preferred_State No_Null_Position Volatile Bitfield

            Item(Local ): Usage, data= [ 0x02 ] 2
                            Present Status
            Item(Main  ): Collection, data= [ 0x02 ] 2
                            Logical

                Item(Global): Report ID, data= [ 0x23 ] 35
                Item(Global): Report Size, data= [ 0x01 ] 1
                Item(Global): Report Count, data= [ 0x02 ] 2
                Item(Global): Logical Minimum, data= [ 0x00 ] 0
                Item(Global): Logical Maximum, data= [ 0x01 ] 1
                Item(Global): Unit, data= [ 0x00 ] 0
                                System: None, Unit: (None)
                Item(Global): Unit Exponent, data= [ 0x00 ] 0
                                Unit Exponent: 0
                Item(Main  ): Feature, data= [ 0x01 ] 1
                                Constant Array Absolute No_Wrap Linear
                                Preferred_State No_Null_Position Non_Volatile Bitfield
                Item(Global): Report Count, data= [ 0x06 ] 6
                Item(Global): Usage Page, data= [ 0x85 ] 133
                                Battery System Page
                Item(Local ): Usage, data= [ 0x42 ] 66
                                Below Remaining Capacity Limit
                Item(Local ): Usage, data= [ 0x46 ] 70
                                Fully Charged
                Item(Local ): Usage, data= [ 0x44 ] 68
                                Charging
                Item(Local ): Usage, data= [ 0x45 ] 69
                                Discharging
                Item(Local ): Usage, data= [ 0x47 ] 71
                                Fully Discharged
                Item(Local ): Usage, data= [ 0x4b ] 75
                                Need Replacement
                Item(Main  ): Feature, data= [ 0x82 ] 130
                                Data Variable Absolute No_Wrap Linear
                                Preferred_State No_Null_Position Volatile Bitfield

            Item(Main  ): End Collection, data=none

            Item(Global): Report ID, data= [ 0x21 ] 33
            Item(Local ): Usage, data= [ 0x66 ] 102
                            Remaining Capacity
            Item(Global): Report Size, data= [ 0x08 ] 8
            Item(Global): Report Count, data= [ 0x01 ] 1
            Item(Global): Logical Maximum, data= [ 0x64 ] 100
            Item(Main  ): Feature, data= [ 0xa2 ] 162
                            Data Variable Absolute No_Wrap Linear
                            No_Preferred_State No_Null_Position Volatile Bitfield

            Item(Global): Report ID, data= [ 0x10 ] 16
            Item(Global): Usage Page, data= [ 0x84 ] 132
                            Power Device Page
            Item(Local ): Usage, data= [ 0x58 ] 88
                            Test
            Item(Global): Logical Maximum, data= [ 0x06 ] 6
            Item(Main  ): Feature, data= [ 0x82 ] 130
                            Data Variable Absolute No_Wrap Linear
                            Preferred_State No_Null_Position Volatile Bitfield

        Item(Main  ): End Collection, data=none

    Item(Main  ): End Collection, data=none

    Item(Local ): Usage, data= [ 0x1e ] 30
                    Flow
    Item(Main  ): Collection, data= [ 0x00 ] 0
                    Physical

        Item(Global): Report ID, data= [ 0x01 ] 1
        Item(Local ): Usage, data= [ 0x40 ] 64
                        Config Voltage
        Item(Global): Logical Maximum, data= [ 0xff 0x00 ] 255
        Item(Global): Unit, data= [ 0x21 0xd1 0xf0 0x00 ] 15782177
                        System: SI Linear, Unit: Centimeter^2*Gram*Seconds^-3*Ampere^-1
        Item(Global): Unit Exponent, data= [ 0x07 ] 7
                        Unit Exponent: 7
        Item(Main  ): Feature, data= [ 0x03 ] 3
                        Constant Variable Absolute No_Wrap Linear
                        Preferred_State No_Null_Position Non_Volatile Bitfield

        Item(Global): Report ID, data= [ 0x02 ] 2
        Item(Local ): Usage, data= [ 0x42 ] 66
                        Config Frequency
        Item(Global): Unit, data= [ 0x01 0xf0 ] 61441
                        System: SI Linear, Unit: Seconds^-1
        Item(Global): Unit Exponent, data= [ 0x00 ] 0
                        Unit Exponent: 0
        Item(Main  ): Feature, data= [ 0x03 ] 3
                        Constant Variable Absolute No_Wrap Linear
                        Preferred_State No_Null_Position Non_Volatile Bitfield

        Item(Global): Report ID, data= [ 0x55 ] 85
        Item(Global): Usage Page, data= [ 0xff 0xff ] 65535
                        (null)
        Item(Local ): Usage, data= [ 0x97 ] 151
                        (null)
        Item(Global): Unit, data= [ 0x00 ] 0
                        System: None, Unit: (None)
        Item(Global): Unit Exponent, data= [ 0x00 ] 0
                        Unit Exponent: 0
        Item(Main  ): Feature, data= [ 0x82 ] 130
                        Data Variable Absolute No_Wrap Linear
                        Preferred_State No_Null_Position Volatile Bitfield

        Item(Global): Report ID, data= [ 0x03 ] 3
        Item(Global): Usage Page, data= [ 0x84 ] 132
                        Power Device Page
        Item(Local ): Usage, data= [ 0x43 ] 67
                        Config Apparent Power
        Item(Global): Report Size, data= [ 0x10 ] 16
        Item(Global): Logical Maximum, data= [ 0xff 0xff 0x00 0x00 ] 65535
        Item(Global): Unit, data= [ 0x21 0xd1 ] 53537
                        System: SI Linear, Unit: Centimeter^2*Gram*Seconds^-3
        Item(Global): Unit Exponent, data= [ 0x07 ] 7
                        Unit Exponent: 7
        Item(Main  ): Feature, data= [ 0x03 ] 3
                        Constant Variable Absolute No_Wrap Linear
                        Preferred_State No_Null_Position Non_Volatile Bitfield

    Item(Main  ): End Collection, data=none

    Item(Local ): Usage, data= [ 0x16 ] 22
                    Power Converter
    Item(Main  ): Collection, data= [ 0x00 ] 0
                    Physical
        Item(Local ): Usage, data= [ 0x1a ] 26
                        Input
        Item(Main  ): Collection, data= [ 0x02 ] 2
                        Logical

            Item(Global): Report ID, data= [ 0x18 ] 24
            Item(Local ): Usage, data= [ 0x30 ] 48
                            Voltage
            Item(Global): Unit, data= [ 0x21 0xd1 0xf0 0x00 ] 15782177
                            System: SI Linear, Unit: Centimeter^2*Gram*Seconds^-3*Ampere^-1
            Item(Global): Unit Exponent, data= [ 0x01 ] 1
                            Unit Exponent: 1
            Item(Main  ): Feature, data= [ 0x82 ] 130
                            Data Variable Absolute No_Wrap Linear
                            Preferred_State No_Null_Position Volatile Bitfield

            Item(Global): Report ID, data= [ 0x19 ] 25
            Item(Local ): Usage, data= [ 0x32 ] 50
                            Frequency
            Item(Global): Unit, data= [ 0x01 0xf0 ] 61441
                            System: SI Linear, Unit: Seconds^-1
            Item(Global): Unit Exponent, data= [ 0x01 ] 1
                            Unit Exponent: 1
            Item(Main  ): Feature, data= [ 0x82 ] 130
                            Data Variable Absolute No_Wrap Linear
                            Preferred_State No_Null_Position Volatile Bitfield

        Item(Main  ): End Collection, data=none

        Item(Local ): Usage, data= [ 0x1c ] 28
                        Output
        Item(Main  ): Collection, data= [ 0x02 ] 2
                        Logical

            Item(Global): Report ID, data= [ 0x1b ] 27
            Item(Local ): Usage, data= [ 0x30 ] 48
                            Voltage
            Item(Global): Unit, data= [ 0x21 0xd1 0xf0 0x00 ] 15782177
                            System: SI Linear, Unit: Centimeter^2*Gram*Seconds^-3*Ampere^-1
            Item(Global): Unit Exponent, data= [ 0x01 ] 1
                            Unit Exponent: 1
            Item(Main  ): Feature, data= [ 0x82 ] 130
                            Data Variable Absolute No_Wrap Linear
                            Preferred_State No_Null_Position Volatile Bitfield

            Item(Global): Report ID, data= [ 0x1c ] 28
            Item(Local ): Usage, data= [ 0x32 ] 50
                            Frequency
            Item(Global): Unit, data= [ 0x01 0xf0 ] 61441
                            System: SI Linear, Unit: Seconds^-1
            Item(Global): Unit Exponent, data= [ 0x01 ] 1
                            Unit Exponent: 1
            Item(Main  ): Feature, data= [ 0x82 ] 130
                            Data Variable Absolute No_Wrap Linear
                            Preferred_State No_Null_Position Volatile Bitfield

            Item(Global): Report ID, data= [ 0x46 ] 70
            Item(Local ): Usage, data= [ 0x31 ] 49
                            Current
            Item(Global): Unit, data= [ 0x01 0x00 0x10 0x00 ] 1048577
                            System: SI Linear, Unit: Ampere
            Item(Global): Unit Exponent, data= [ 0x01 ] 1
                            Unit Exponent: 1
            Item(Main  ): Feature, data= [ 0x82 ] 130
                            Data Variable Absolute No_Wrap Linear
                            Preferred_State No_Null_Position Volatile Bitfield

            Item(Global): Report ID, data= [ 0x47 ] 71
            Item(Local ): Usage, data= [ 0x34 ] 52
                            Active Power
            Item(Global): Unit, data= [ 0x21 0xd1 ] 53537
                            System: SI Linear, Unit: Centimeter^2*Gram*Seconds^-3
            Item(Global): Unit Exponent, data= [ 0x07 ] 7
                            Unit Exponent: 7
            Item(Main  ): Feature, data= [ 0x82 ] 130
                            Data Variable Absolute No_Wrap Linear
                            Preferred_State No_Null_Position Volatile Bitfield

            Item(Global): Report ID, data= [ 0x06 ] 6
            Item(Local ): Usage, data= [ 0x53 ] 83
                            Low Voltage Transfer
            Item(Global): Unit, data= [ 0x21 0xd1 0xf0 0x00 ] 15782177
                            System: SI Linear, Unit: Centimeter^2*Gram*Seconds^-3*Ampere^-1
            Item(Global): Unit Exponent, data= [ 0x07 ] 7
                            Unit Exponent: 7
            Item(Main  ): Feature, data= [ 0xa2 ] 162
                            Data Variable Absolute No_Wrap Linear
                            No_Preferred_State No_Null_Position Volatile Bitfield

            Item(Global): Report ID, data= [ 0x09 ] 9
            Item(Local ): Usage, data= [ 0x54 ] 84
                            High Voltage Transfer
            Item(Main  ): Feature, data= [ 0xa2 ] 162
                            Data Variable Absolute No_Wrap Linear
                            No_Preferred_State No_Null_Position Volatile Bitfield

        Item(Main  ): End Collection, data=none

        Item(Local ): Usage, data= [ 0x02 ] 2
                        Present Status
        Item(Main  ): Collection, data= [ 0x02 ] 2
                        Logical

            Item(Global): Report ID, data= [ 0x22 ] 34
            Item(Global): Report Size, data= [ 0x01 ] 1
            Item(Global): Report Count, data= [ 0x03 ] 3
            Item(Global): Logical Minimum, data= [ 0x00 ] 0
            Item(Global): Logical Maximum, data= [ 0x01 ] 1
            Item(Global): Unit, data= [ 0x00 ] 0
                            System: None, Unit: (None)
            Item(Global): Unit Exponent, data= [ 0x00 ] 0
                            Unit Exponent: 0
            Item(Local ): Usage, data= [ 0x63 ] 99
                            Voltage out of range
            Item(Local ): Usage, data= [ 0x6f ] 111
                            Buck
            Item(Local ): Usage, data= [ 0x6e ] 110
                            Boost
            Item(Main  ): Feature, data= [ 0x82 ] 130
                            Data Variable Absolute No_Wrap Linear
                            Preferred_State No_Null_Position Volatile Bitfield
            Item(Global): Report Count, data= [ 0x01 ] 1
            Item(Main  ): Feature, data= [ 0x03 ] 3
                            Constant Variable Absolute No_Wrap Linear
                            Preferred_State No_Null_Position Non_Volatile Bitfield
            Item(Local ): Usage, data= [ 0x65 ] 101
                            Overload
            Item(Main  ): Feature, data= [ 0x82 ] 130
                            Data Variable Absolute No_Wrap Linear
                            Preferred_State No_Null_Position Volatile Bitfield
            Item(Local ): Usage, data= [ 0x6d ] 109
                            Used
            Item(Main  ): Feature, data= [ 0x03 ] 3
                            Constant Variable Absolute No_Wrap Linear
                            Preferred_State No_Null_Position Non_Volatile Bitfield
            Item(Local ): Usage, data= [ 0x67 ] 103
                            Over Temperature
            Item(Local ): Usage, data= [ 0x62 ] 98
                            Internal Failure
            Item(Global): Report Count, data= [ 0x02 ] 2
            Item(Main  ): Feature, data= [ 0x82 ] 130
                            Data Variable Absolute No_Wrap Linear
                            Preferred_State No_Null_Position Volatile Bitfield
            Item(Global): Report Count, data= [ 0x06 ] 6
            Item(Main  ): Feature, data= [ 0x03 ] 3
                            Constant Variable Absolute No_Wrap Linear
                            Preferred_State No_Null_Position Non_Volatile Bitfield
            Item(Global): Report Count, data= [ 0x01 ] 1
            Item(Local ): Usage, data= [ 0x72 ] 114
                            Awaiting Power
            Item(Main  ): Feature, data= [ 0x82 ] 130
                            Data Variable Absolute No_Wrap Linear
                            Preferred_State No_Null_Position Volatile Bitfield
            Item(Main  ): Feature, data= [ 0x01 ] 1
                            Constant Array Absolute No_Wrap Linear
                            Preferred_State No_Null_Position Non_Volatile Bitfield

        Item(Main  ): End Collection, data=none

    Item(Main  ): End Collection, data=none

    Item(Local ): Usage, data= [ 0x18 ] 24
                    Outlet System
    Item(Main  ): Collection, data= [ 0x02 ] 2
                    Logical

        Item(Local ): Usage, data= [ 0x20 ] 32
                        Outlet
        Item(Main  ): Collection, data= [ 0x02 ] 2
                        Logical

            Item(Global): Report ID, data= [ 0x15 ] 21
            Item(Local ): Usage, data= [ 0x57 ] 87
                            Delay Before Shutdown
            Item(Global): Report Size, data= [ 0x10 ] 16
            Item(Global): Report Count, data= [ 0x01 ] 1
            Item(Global): Logical Maximum, data= [ 0xff 0xff 0x00 0x00 ] 65535
            Item(Global): Unit, data= [ 0x01 0x10 ] 4097
                            System: SI Linear, Unit: Seconds
            Item(Global): Unit Exponent, data= [ 0x00 ] 0
                            Unit Exponent: 0
            Item(Main  ): Feature, data= [ 0x82 ] 130
                            Data Variable Absolute No_Wrap Linear
                            Preferred_State No_Null_Position Volatile Bitfield

            Item(Global): Usage Page, data= [ 0xff 0xff ] 65535
                            (null)

            Item(Global): Report ID, data= [ 0x16 ] 22
            Item(Local ): Usage, data= [ 0x56 ] 86
                            (null)
            Item(Global): Logical Minimum, data= [ 0xff ] 255
            Item(Global): Logical Maximum, data= [ 0xff 0x7f ] 32767
            Item(Global): Physical Minimum, data= [ 0xc4 ] 196
            Item(Global): Physical Maximum, data= [ 0xc4 0xff 0x1d 0x00 ] 1966020
            Item(Global): Unit, data= [ 0x01 0x10 ] 4097
                            System: SI Linear, Unit: Seconds
            Item(Main  ): Feature, data= [ 0x82 ] 130
                            Data Variable Absolute No_Wrap Linear
                            Preferred_State No_Null_Position Volatile Bitfield

            Item(Global): Usage Page, data= [ 0x84 ] 132
                            Power Device Page

            Item(Global): Report ID, data= [ 0x17 ] 23
            Item(Local ): Usage, data= [ 0x55 ] 85
                            Delay Before Reboot
            Item(Global): Logical Minimum, data= [ 0x00 ] 0
            Item(Global): Logical Maximum, data= [ 0xff 0xff 0x00 0x00 ] 65535
            Item(Global): Physical Minimum, data= [ 0x00 ] 0
            Item(Global): Physical Maximum, data= [ 0x00 ] 0
            Item(Main  ): Feature, data= [ 0x82 ] 130
                            Data Variable Absolute No_Wrap Linear
                            Preferred_State No_Null_Position Volatile Bitfield

            Item(Global): Report ID, data= [ 0x61 ] 97
            Item(Local ): Usage, data= [ 0x56 ] 86
                            Delay Before Startup
            Item(Main  ): Feature, data= [ 0x82 ] 130
                            Data Variable Absolute No_Wrap Linear
                            Preferred_State No_Null_Position Volatile Bitfield

            Item(Global): Report ID, data= [ 0x1e ] 30
            Item(Local ): Usage, data= [ 0x35 ] 53
                            Percent Load
            Item(Global): Report Size, data= [ 0x08 ] 8
            Item(Global): Logical Maximum, data= [ 0xff 0x00 ] 255
            Item(Global): Unit, data= [ 0x00 ] 0
                            System: None, Unit: (None)
            Item(Main  ): Feature, data= [ 0x82 ] 130
                            Data Variable Absolute No_Wrap Linear
                            Preferred_State No_Null_Position Volatile Bitfield

            Item(Global): Usage Page, data= [ 0xff 0xff ] 65535
                            (null)

            Item(Global): Report ID, data= [ 0x41 ] 65
            Item(Local ): Usage, data= [ 0x81 ] 129
                            (null)
            Item(Global): Unit, data= [ 0x01 0x10 ] 4097
                            System: SI Linear, Unit: Seconds
            Item(Main  ): Feature, data= [ 0x82 ] 130
                            Data Variable Absolute No_Wrap Linear
                            Preferred_State No_Null_Position Volatile Bitfield

            Item(Global): Report ID, data= [ 0x51 ] 81
            Item(Local ): Usage, data= [ 0x91 ] 145
                            (null)
            Item(Global): Unit, data= [ 0x00 ] 0
                            System: None, Unit: (None)
            Item(Main  ): Feature, data= [ 0x82 ] 130
                            Data Variable Absolute No_Wrap Linear
                            Preferred_State No_Null_Position Volatile Bitfield

            Item(Global): Report ID, data= [ 0x52 ] 82
            Item(Local ): Usage, data= [ 0x92 ] 146
                            (null)
            Item(Main  ): Feature, data= [ 0x82 ] 130
                            Data Variable Absolute No_Wrap Linear
                            Preferred_State No_Null_Position Volatile Bitfield

        Item(Main  ): End Collection, data=none

    Item(Main  ): End Collection, data=none

    Item(Global): Usage Page, data= [ 0xff 0xff ] 65535
                    (null)
    Item(Local ): Usage, data= [ 0xfe ] 254
                    (null)
    Item(Main  ): Collection, data= [ 0x02 ] 2
                    Logical

        Item(Global): Report Size, data= [ 0x08 ] 8
        Item(Global): Report Count, data= [ 0x01 ] 1
        Item(Global): Logical Minimum, data= [ 0x00 ] 0
        Item(Global): Logical Maximum, data= [ 0xff 0x00 ] 255
        Item(Global): Report ID, data= [ 0x0d ] 13
        Item(Local ): Usage, data= [ 0x75 ] 117
                        (null)
        Item(Main  ): Feature, data= [ 0x03 ] 3
                        Constant Variable Absolute No_Wrap Linear
                        Preferred_State No_Null_Position Non_Volatile Bitfield

        Item(Global): Report ID, data= [ 0x0e ] 14
        Item(Local ): Usage, data= [ 0x76 ] 118
                        (null)
        Item(Main  ): Feature, data= [ 0x03 ] 3
                        Constant Variable Absolute No_Wrap Linear
                        Preferred_State No_Null_Position Non_Volatile Bitfield

        Item(Global): Report ID, data= [ 0x0f ] 15
        Item(Local ): Usage, data= [ 0x7c ] 124
                        (null)
        Item(Main  ): Feature, data= [ 0x82 ] 130
                        Data Variable Absolute No_Wrap Linear
                        Preferred_State No_Null_Position Volatile Bitfield

        Item(Global): Report ID, data= [ 0x43 ] 67
        Item(Local ): Usage, data= [ 0x9c ] 156
                        (null)
        Item(Global): Report Size, data= [ 0x08 ] 8
        Item(Global): Logical Maximum, data= [ 0xff 0x00 ] 255
        Item(Main  ): Feature, data= [ 0x82 ] 130
                        Data Variable Absolute No_Wrap Linear
                        Preferred_State No_Null_Position Volatile Bitfield

        Item(Global): Report ID, data= [ 0x57 ] 87
        Item(Local ): Usage, data= [ 0xa0 ] 160
                        (null)
        Item(Main  ): Feature, data= [ 0x03 ] 3
                        Constant Variable Absolute No_Wrap Linear
                        Preferred_State No_Null_Position Non_Volatile Bitfield

        Item(Global): Report ID, data= [ 0x58 ] 88
        Item(Local ): Usage, data= [ 0xa1 ] 161
                        (null)
        Item(Main  ): Feature, data= [ 0x03 ] 3
                        Constant Variable Absolute No_Wrap Linear
                        Preferred_State No_Null_Position Non_Volatile Bitfield

        Item(Global): Report ID, data= [ 0x59 ] 89
        Item(Local ): Usage, data= [ 0xa2 ] 162
                        (null)
        Item(Main  ): Feature, data= [ 0x03 ] 3
                        Constant Variable Absolute No_Wrap Linear
                        Preferred_State No_Null_Position Non_Volatile Bitfield

        Item(Global): Report ID, data= [ 0x6c ] 108
        Item(Local ): Usage, data= [ 0x7d ] 125
                        (null)
        Item(Global): Report Size, data= [ 0x10 ] 16
        Item(Global): Logical Maximum, data= [ 0xff 0xff 0x00 0x00 ] 65535
        Item(Main  ): Feature, data= [ 0x03 ] 3
                        Constant Variable Absolute No_Wrap Linear
                        Preferred_State No_Null_Position Non_Volatile Bitfield

        Item(Global): Report ID, data= [ 0x5d ] 93
        Item(Local ): Usage, data= [ 0x62 ] 98
                        (null)
        Item(Global): Report Size, data= [ 0x08 ] 8
        Item(Global): Report Count, data= [ 0x01 ] 1
        Item(Global): Logical Maximum, data= [ 0xff 0x00 ] 255
        Item(Global): Unit, data= [ 0x00 ] 0
                        System: None, Unit: (None)
        Item(Global): Unit Exponent, data= [ 0x00 ] 0
                        Unit Exponent: 0
        Item(Main  ): Feature, data= [ 0x03 ] 3
                        Constant Variable Absolute No_Wrap Linear
                        Preferred_State No_Null_Position Non_Volatile Bitfield

        Item(Global): Report ID, data= [ 0x60 ] 96
        Item(Local ): Usage, data= [ 0x60 ] 96
                        (null)
        Item(Main  ): Feature, data= [ 0x03 ] 3
                        Constant Variable Absolute No_Wrap Linear
                        Preferred_State No_Null_Position Non_Volatile Bitfield

    Item(Main  ): End Collection, data=none

    Item(Global): Usage Page, data= [ 0xff 0xff ] 65535
                    (null)
    Item(Local ): Usage, data= [ 0xff ] 255
                    (null)
    Item(Main  ): Collection, data= [ 0x02 ] 2
                    Logical

        Item(Global): Report ID, data= [ 0xc2 ] 194
        Item(Local ): Usage, data= [ 0xd6 ] 214
                        (null)
        Item(Global): Report Size, data= [ 0x20 ] 32
        Item(Global): Report Count, data= [ 0x01 ] 1
        Item(Global): Logical Maximum, data= [ 0xff 0xff 0xff 0x7f ] 2147483647
        Item(Global): Logical Minimum, data= [ 0x01 0x00 0x00 0x80 ] -2147483647
        Item(Main  ): Feature, data= [ 0x02 ] 2
                        Data Variable Absolute No_Wrap Linear
                        Preferred_State No_Null_Position Non_Volatile Bitfield

        Item(Global): Report ID, data= [ 0xc3 ] 195
        Item(Local ): Usage, data= [ 0xd7 ] 215
                        (null)
        Item(Main  ): Feature, data= [ 0x02 ] 2
                        Data Variable Absolute No_Wrap Linear
                        Preferred_State No_Null_Position Non_Volatile Bitfield

        Item(Global): Report ID, data= [ 0xe3 ] 227
        Item(Local ): Usage, data= [ 0xef ] 239
                        (null)
        Item(Global): Report Size, data= [ 0x08 ] 8
        Item(Global): Report Count, data= [ 0x07 ] 7
        Item(Global): Logical Maximum, data= [ 0xff 0x00 ] 255
        Item(Global): Logical Minimum, data= [ 0x00 ] 0
        Item(Main  ): Input, data= [ 0x82 ] 130
                        Data Variable Absolute No_Wrap Linear
                        Preferred_State No_Null_Position Volatile Bitfield
        Item(Local ): Usage, data= [ 0xef ] 239
                        (null)
        Item(Main  ): Feature, data= [ 0x82 ] 130
                        Data Variable Absolute No_Wrap Linear
                        Preferred_State No_Null_Position Volatile Bitfield

    Item(Main  ): End Collection, data=none
    
Item(Main  ): End Collection, data=none